Sheet: СЛАУ
A1: Прямой ход | F1: Решение СЛАУ методом Гаусса
A2: № Ур-я | B2: Коэффициенты | E2: Свободн ые члены | F2: Алгоритм метода Гаусса
B3: a1 | C3: a2 | D3: a3 | E3: b
A4: 1 | B4: 3.7 | C4: 3.1 | D4: 4 | E4: 5 | F4: Исходные ур-я
A5: 2 | B5: 4.1 | C5: 4.5 | D5: -4.8 | E5: 4.9
A6: 3 | B6: -2.1 | C6: -3.7 | D6: 1.8 | E6: 2.7
A7: 1 | B7: of:=[.B4]/[.B4] -> 1 | C7: of:=[.C4]/[.B4] -> 0.837837837837838 | D7: of:=[.D4]/[.B4] -> 1.08108108108108 | E7: of:=[.E4]/[.B4] -> 1.35135135135135 | F7: Делим первое уравнение на ведущий коэффициент(a11)
A8: 1 | B8: of:=[.B7]*[.B5] -> 4.1 | C8: of:=[.C7]*[.B5] -> 3.43513513513514 | D8: of:=[.D7]*[.B5] -> 4.43243243243243 | E8: of:=[.E7]*[.B5] -> 5.54054054054054 | F8: Умножаем первое уравнение на а21 (первый коэффициент второго ур-я)
A9: 2 | B9: 0 | C9: of:=[.C5]-[.C8] -> 1.06486486486487 | D9: of:=[.D5]-[.D8] -> -9.23243243243243 | E9: of:=[.E5]-[.E8] -> -0.64054054054054 | F9: Вычитаем из второго ур-я первое
A10: 1 | B10: of:=[.B7]*[.B6] -> -2.1 | C10: of:=[.C7]*[.B6] -> -1.75945945945946 | D10: of:=[.D7]*[.B6] -> -2.27027027027027 | E10: of:=[.E7]*[.B6] -> -2.83783783783784 | F10: Умножаем первое уравнение на а31
A11: 3 | B11: 0 | C11: of:=[.C6]-[.C10] -> -1.94054054054054 | D11: of:=[.D6]-[.D10] -> 4.07027027027027 | E11: of:=[.E6]-[.E10] -> 5.53783783783784 | F11: Вычитаем из третьего ур-я первое
A12: 2 | C12: of:=[.C9]/[.C9] -> 1 | D12: of:=[.D9]/[.C9] -> -8.67005076142132 | E12: of:=[.E9]/[.C9] -> -0.601522842639593 | F12: Делим второе ур-е на первый коэффициент
A13: 2 | C13: of:=[.C12]*[.C11] -> -1.94054054054054 | D13: of:=[.D12]*[.C11] -> 16.8245849910825 | E13: of:=[.E12]*[.C11] -> 1.16727946220332 | F13: Умножаем второе ур-е на коэффициент а32
A14: 3 | C14: 0 | D14: of:=[.D11]-[.D13] -> -12.7543147208122 | E14: of:=[.E11]-[.E13] -> 4.37055837563452 | F14: Вычитаем из третьего ур-я второе
A15: Обратный ход | D15: X3 = | E15: of:=[.E14]/[.D14] -> -0.342672928440658 | F15: Решение системы
D16: X2 = | E16: of:=([.E9]-([.D9]*[.E15]))/[.C9] -> -3.57251452678498
D17: X1 = | E17: of:=([.E4]-([.C4]*[.E16])-([.D4]*[.E15]))/[.B4] -> 4.71499641805299